RiskID,Risk,Impact,Likelihood,Treatment,Owner,Status
P09-001,Purview feature unavailable due to licensing,Configuration cannot be completed as planned,Medium,Purview portal areas and command availability reviewed before configuration,Compliance Administrator,Mitigated
P09-002,Compliance roles missing,Admin cannot configure labels DLP retention or audit,Medium,Purview role group visibility and membership reviewed before configuration,Compliance Administrator,Mitigated
P09-003,Sensitivity labels published too broadly,Users see unvalidated classification labels,Medium,Labels published only to pilot users,Information Protection Administrator,Mitigated
P09-004,Sensitivity label configuration too complex,User confusion and poor adoption,Medium,Simple Public Internal Confidential and Highly Confidential model used,Information Protection Administrator,Mitigated
P09-005,DLP policy enforced too early,Legitimate business sharing blocked,High,DLP hands-on configuration skipped and no enforcement enabled,DLP Administrator,Mitigated
P09-006,DLP policy scoped incorrectly,Wrong users or locations affected,Medium,No DLP policy was created and DLP remains design-only,DLP Administrator,Mitigated
P09-007,Retention policy deletes content unexpectedly,Data loss or compliance issue,High,Retention design used deactivate retention settings and no automatic deletion,Compliance Administrator,Mitigated
P09-008,Retention labels misunderstood as immediate deletion,Validation confusion,Medium,Retention behavior documented as non-destructive lifecycle governance,Compliance Administrator,Mitigated
P09-009,eDiscovery search exposes private content,Privacy issue,High,No Content Search eDiscovery case or search export was created,eDiscovery Manager,Mitigated
P09-010,Audit evidence exposes IP or location,Privacy issue,Medium,Audit export excluded ClientIP IP location AuditData and ObjectId fields,Audit Reader,Mitigated
P09-011,Private document content exposed in evidence,Privacy issue,High,No private document content or search result previews were exported,Compliance Administrator,Mitigated
P09-012,Private email body content exposed in evidence,Privacy issue,High,No private email body content or mailbox item details were exported,eDiscovery Manager,Mitigated
P09-013,Search result previews exposed in screenshots,Privacy issue,Medium,Content Search and eDiscovery workflow reviewed without publishing result previews,eDiscovery Manager,Mitigated
P09-014,Rollback process missing,Policy recovery delayed,Medium,Create rollback plan before final validation,Compliance Administrator,Open
P09-015,Emergency access modified during compliance work,Tenant recovery risk,High,Do not remove or weaken emergency access,Identity Administrator,Open
P09-016,Pilot mailbox readiness not validated,Purview policy scope may target unavailable users,Medium,Pilot mailbox readiness exported for Emma Olivia and Sophia,Compliance Administrator,Mitigated
P09-017,Audit readiness not validated before compliance work,Audit evidence may be incomplete,Medium,Unified audit configuration and sanitized audit baseline reviewed,Audit Reader,Mitigated
P09-018,Role membership changed unintentionally,Compliance permissions altered unexpectedly,Medium,Role groups were reviewed only and no role assignments were changed,Compliance Administrator,Mitigated
P09-019,Content Explorer exposes item-level content,Privacy issue,Medium,Content Explorer was review-only and no item-level content was exported,Compliance Administrator,Mitigated
P09-020,Activity Explorer unavailable or empty,Validation confusion,Low,Feature availability limitations are documented as acceptable in lab tenant,Compliance Administrator,Mitigated
P09-021,Sensitivity labels not validated after creation,README may overstate label configuration,Medium,Labels exported after creation and summary evidence created,Information Protection Administrator,Mitigated
P09-022,Label publishing policy missing,Labels may not appear for pilot users,Medium,Pilot label publishing policy created or confirmed,Information Protection Administrator,Mitigated
P09-023,Label policy scoped tenant-wide accidentally,Unvalidated labels exposed to all users,Medium,Label policy scoped to pilot users only,Information Protection Administrator,Mitigated
P09-024,Mandatory labeling enabled too early,User productivity impact,Medium,Mandatory labeling was not enabled during pilot validation,Information Protection Administrator,Mitigated
P09-025,Default label applied before validation,Unexpected classification applied to user content,Medium,No default label configured in pilot publishing policy,Information Protection Administrator,Mitigated
P09-026,Encryption enabled before pilot readiness,Access or sharing disruption,Medium,Encryption enforcement was not configured for Project 09 labels,Information Protection Administrator,Mitigated
P09-027,Auto-labeling enabled too early,Unexpected classification behavior,Medium,Auto-labeling was not enabled during Batch 3,Information Protection Administrator,Mitigated
P09-028,Private document or email content exposed during label validation,Privacy issue,High,Label visibility reviewed with blank or safe lab-only draft and no private content exported,Compliance Administrator,Mitigated
P09-029,Label propagation delay misunderstood as failure,Validation confusion,Low,Propagation delay documented as expected behavior,Information Protection Administrator,Mitigated
P09-030,DLP licensing or cost prevents hands-on configuration,DLP implementation cannot be completed in lab,Medium,DLP documented as design-only with licensing limitation,Compliance Administrator,Accepted
P09-031,README overstates DLP implementation,Portfolio accuracy issue,Medium,README accuracy note created stating no DLP policy or rules were configured,Compliance Administrator,Mitigated
P09-032,DLP test-mode validation claimed without policy creation,Portfolio accuracy issue,Medium,Final documentation states test-mode validation was not performed,Compliance Administrator,Mitigated
P09-033,DLP alert generation claimed without DLP policy,Portfolio accuracy issue,Medium,Documentation states no DLP alerts were generated,Compliance Administrator,Mitigated
P09-034,Sensitive values uploaded for DLP testing,Privacy or compliance issue,High,No sensitive values were uploaded or tested,Compliance Administrator,Mitigated
P09-035,Private content exposed during DLP review,Privacy issue,High,DLP review was design-only and no private document or email content was exported,Compliance Administrator,Mitigated
P09-036,DLP portal screenshot exposes sensitive content,Privacy issue,Medium,Screenshots must be sanitized and only show portal/policy area without private content,Compliance Administrator,Mitigated
P09-037,DLP limitation weakens project credibility,Portfolio presentation risk,Low,Limitation documented transparently as cost-aware project scoping,Compliance Administrator,Accepted
P09-038,Retention labels configured with destructive end action,Data lifecycle or data loss risk,High,After-retention action set to deactivate retention settings instead of delete automatically,Compliance Administrator,Mitigated
P09-039,Retention label publishing requires additional licensing or cost,Publishing cannot be completed hands-on in lab,Medium,Publishing documented as design-only with licensing limitation,Compliance Administrator,Accepted
P09-040,README overstates retention publishing implementation,Portfolio accuracy issue,Medium,README accuracy note created stating no publishing policy was created,Compliance Administrator,Mitigated
P09-041,Retention labels claimed as published to users,Portfolio accuracy issue,Medium,Final documentation states labels were not published to users,Compliance Administrator,Mitigated
P09-042,Auto-apply retention policy created accidentally,Unexpected retention application to content,High,No auto-apply policy configured and design explicitly excludes auto-apply,Compliance Administrator,Mitigated
P09-043,Record or regulatory record enforcement enabled accidentally,User or compliance workflow disruption,High,No record or regulatory record behavior configured,Compliance Administrator,Mitigated
P09-044,Disposition review configured accidentally,Unexpected review workflow or administrative overhead,Medium,No disposition review configured,Compliance Administrator,Mitigated
P09-045,Broad tenant retention policy created too early,Tenant-wide content lifecycle impact,High,No broad tenant retention policy created,Compliance Administrator,Mitigated
P09-046,Private content exposed during retention review,Privacy issue,High,No private document or email content exported and screenshots require sanitization,Compliance Administrator,Mitigated
P09-047,Retention licensing limitation weakens project credibility,Portfolio presentation risk,Low,Limitation documented transparently as cost-aware project scoping,Compliance Administrator,Accepted
P09-048,Content Search created unintentionally,Private data discovery scope created unnecessarily,Medium,Content Search workflow was reviewed only and no search was created,eDiscovery Manager,Mitigated
P09-049,eDiscovery case created unintentionally,Unnecessary compliance case or data scope created,Medium,eDiscovery workflow was reviewed only and no case was created,eDiscovery Manager,Mitigated
P09-050,eDiscovery export performed accidentally,Private Microsoft 365 content exposed,High,No eDiscovery or Content Search export was performed,eDiscovery Manager,Mitigated
P09-051,AuditData payload exported,Private operational details exposed,High,Unified audit export excluded AuditData and used sanitized fields only,Audit Reader,Mitigated
P09-052,ObjectId exposes file paths URLs or message IDs,Privacy issue,Medium,ObjectId was intentionally excluded from audit evidence,Audit Reader,Mitigated
P09-053,Activity Explorer or Content Explorer unavailable,Validation confusion,Low,Unavailable or empty results documented as acceptable feature limitation,Compliance Administrator,Mitigated
P09-054,Compliance alerts unavailable or empty,Validation confusion,Low,No-alert result documented as acceptable for small lab tenant,Compliance Administrator,Mitigated
P09-055,Monitoring screenshots expose sensitive item-level data,Privacy issue,Medium,Screenshots must be sanitized and private item-level content was not opened for evidence,Compliance Administrator,Mitigated
P09-056,Final README overstates eDiscovery implementation,Portfolio accuracy issue,Medium,Final documentation must state workflow was reviewed only and no case search or export was created,eDiscovery Manager,Mitigated
P09-057,Final README overstates DLP implementation,Portfolio accuracy issue,Medium,Final validation and README prep notes state DLP was design-only due to licensing/cost limitation,Compliance Administrator,Mitigated
P09-058,Final README overstates retention label publishing,Portfolio accuracy issue,Medium,Final validation and README prep notes state retention label publishing was design-only due to licensing/cost limitation,Compliance Administrator,Mitigated
P09-059,Final README claims Content Search was created,Portfolio accuracy and privacy issue,Medium,Final documentation states Content Search workflow was reviewed only and no search was created,eDiscovery Manager,Mitigated
P09-060,Final README claims eDiscovery case or export was created,Portfolio accuracy and privacy issue,Medium,Final documentation states no eDiscovery case hold search or export was created,eDiscovery Manager,Mitigated
P09-061,Final evidence exposes private document or email content,Privacy issue,High,Final privacy-safe evidence note confirms private document and email content were excluded,Compliance Administrator,Mitigated
P09-062,Final evidence exposes public IP or location data,Privacy issue,Medium,Final privacy-safe evidence note confirms IP and location data were excluded,Compliance Administrator,Mitigated
P09-063,Final validation missing limitation evidence,README may not explain skipped controls,Medium,Final limitation validation and README preparation note created,Compliance Administrator,Mitigated
P09-064,Final validation missing sensitivity label evidence,Configured label work may be unproven,Medium,Final sensitivity label and label policy state exported,Information Protection Administrator,Mitigated
P09-065,Final validation missing retention label evidence,Retention work may be unclear,Medium,Final retention label state exported or limitation documented,Compliance Administrator,Mitigated
P09-066,Final portfolio sequence lacks clear ending,Reader may expect Sentinel or additional projects,Low,Project 09 documented as final project in current portfolio sequence,Project Owner,Mitigated
